<?xml version='1.0' encoding='UTF-8' ?>
<partida xmlns:xsi='http://www.w3.org/2001/XMLSchema-instance'
         xsi:noNamespaceSchemaLocation='partida.xsd'
         fecha='2025-09-24'
         horaIni='23:20:45.516338'
         horaFin='23:23:30.540328'>
    <jugadores>
        <jugador id='1'>Mikel</jugador>
        <jugador id='2'>Laura</jugador>
    </jugadores>
    <mapa>
        <territorio>
            <nombre>Buztintxuri</nombre>
            <propietario>1</propietario>
            <ejercitos>4</ejercitos>
        </territorio>
        <territorio>
            <nombre>Arrosadia</nombre>
            <propietario>2</propietario>
            <ejercitos>3</ejercitos>
        </territorio>
        <territorio>
            <nombre>Txantrea</nombre>
            <propietario>1</propietario>
            <ejercitos>3</ejercitos>
        </territorio>
        <territorio>
            <nombre>Iturrama</nombre>
            <propietario>2</propietario>
            <ejercitos>4</ejercitos>
        </territorio>
    </mapa>
    <jugadas>
        <ataque>
            <ataca>
                <jugador>1</jugador>
                <territorio>Buztintxuri</territorio>
            </ataca>
            <defiende>
                <jugador>2</jugador>
                <territorio>Arrosadia</territorio>
            </defiende>
            <tirada>
                <dados>
                    <valor>5</valor>
                    <valor>3</valor>
                    <valor>2</valor>
                </dados>
                <dados>
                    <valor>4</valor>
                    <valor>2</valor>
                </dados>
            </tirada>
            <territorio>
                <nombre>Buztintxuri</nombre>
                <propietario>1</propietario>
                <ejercitos>4</ejercitos>
            </territorio>
            <territorio>
                <nombre>Arrosadia</nombre>
                <propietario>2</propietario>
                <ejercitos>1</ejercitos>
            </territorio>
        </ataque>
    </jugadas>
</partida>